### ISSUE TITLE
[Bug]: Persistent AAAA queries on IPv4-only environment (pCloud backend)

### ISSUE THREAD

**Issue by Error-LP0** [rclone/rclone#9224]
Rclone is making repeated AAAA queries for pCloud API endpoints (e.g., eapi.pcloud.com). This occurs despite IPv6 being explicitly disabled at the OS level (via sysctl/kernel parameters). 

rclone 1.73.1
Ubuntu 24.04

ifconfig:
ens18: flags=4163<UP,BROADCAST,RUNNING,MULTICAST>  mtu 1500
        inet 10.0.1.15  netmask 255.255.255.0  broadcast 10.0.1.255
        ether xx:xx:xx:xx:xx:xx  txqueuelen 1000  (Ethernet)
        RX packets 6543154043  bytes 16510393370387 (16.5 TB)
        RX errors 0  dropped 0 overruns 0  frame 0
        TX packets 3416881847  bytes 16636502315952 (16.6 TB)
        TX errors 0  dropped 0 overruns 0  carrier 0  collisions 0

tcpdump snippet showing closely timed AAAA requests:

12:42:12.177324 IP san.49005 > 10.0.6.11.domain: 11683+ [1au] AAAA? eapi.pcloud.com. (44)
12:42:12.177598 IP 10.0.6.11.domain > san.49005: 11683 0/1/1 (129)
12:42:12.188546 IP san.46958 > 10.0.6.11.domain: 13819+ [1au] AAAA? eapi.pcloud.com. (44)
12:42:12.188755 IP 10.0.6.11.domain > san.46958: 13819 0/1/1 (129)
12:42:12.199942 IP san.51512 > 10.0.6.11.domain: 9200+ [1au] AAAA? eapi.pcloud.com. (44)
12:42:12.200192 IP 10.0.6.11.domain > san.51512: 9200 0/1/1 (129)
12:42:12.211259 IP san.48834 > 10.0.6.11.domain: 19593+ [1au] AAAA? eapi.pcloud.com. (44)
12:42:12.211481 IP 10.0.6.11.domain > san.48834: 19593 0/1/1 (129)
12:42:12.221367 IP san.59172 > 10.0.6.11.domain: 19910+ [1au] AAAA? eapi.pcloud.com. (44)
12:42:12.221646 IP 10.0.6.11.domain > san.59172: 19910 0/1/1 (129)
12:42:12.232329 IP san.34648 > 10.0.6.11.domain: 15558+ [1au] AAAA? eapi.pcloud.com. (44)
12:42:12.232619 IP 10.0.6.11.domain > san.34648: 15558 0/1/1 (129)
12:42:12.243153 IP san.55235 > 10.0.6.11.domain: 42297+ [1au] AAAA? eapi.pcloud.com. (44)
12:42:12.243440 IP 10.0.6.11.domain > san.55235: 42297 0/1/1 (129)
12:42:12.254263 IP san.40325 > 10.0.6.11.domain: 40061+ [1au] AAAA? eapi.pcloud.com. (44)
12:42:12.254493 IP 10.0.6.11.domain > san.40325: 40061 0/1/1 (129)
12:42:12.264510 IP san.49758 > 10.0.6.11.domain: 4939+ [1au] AAAA? eapi.pcloud.com. (44)
12:42:12.264769 IP 10.0.6.11.domain > san.49758: 4939 0/1/1 (129)
12:42:12.276473 IP san.46691 > 10.0.6.11.domain: 3900+ [1au] AAAA? eapi.pcloud.com. (44)
12:42:12.276722 IP 10.0.6.11.domain > san.46691: 3900 0/1/1 (129)
12:42:12.295575 IP san.35241 > 10.0.6.11.domain: 52047+ [1au] AAAA? eapi.pcloud.com. (44)
12:42:12.295856 IP 10.0.6.11.domain > san.35241: 52047 0/1/1 (129)
12:42:12.307637 IP san.38262 > 10.0.6.11.domain: 41628+ [1au] AAAA? eapi.pcloud.com. (44)
12:42:12.307839 IP 10.0.6.11.domain > san.38262: 41628 0/1/1 (129)
12:42:12.318335 IP san.56878 > 10.0.6.11.domain: 7053+ [1au] AAAA? eapi.pcloud.com. (44)
12:42:12.318645 IP 10.0.6.11.domain > san.56878: 7053 0/1/1 (129)
12:42:12.328886 IP san.45763 > 10.0.6.11.domain: 28914+ [1au] AAAA? eapi.pcloud.com. (44)
12:42:12.329125 IP 10.0.6.11.domain > san.45763: 28914 0/1/1 (129)
12:42:12.340911 IP san.38710 > 10.0.6.11.domain: 7455+ [1au] AAAA? eapi.pcloud.com. (44)
12:42:12.341956 IP 10.0.6.11.domain > san.38710: 7455 0/1/1 (129)
12:42:12.351066 IP san.56691 > 10.0.6.11.domain: 42173+ [1au] AAAA? eapi.pcloud.com. (44)
12:42:12.351291 IP 10.0.6.11.domain > san.56691: 42173 0/1/1 (129)
12:42:12.361320 IP san.47462 > 10.0.6.11.domain: 1223+ [1au] AAAA? eapi.pcloud.com. (44)
12:42:12.361609 IP 10.0.6.11.domain > san.47462: 1223 0/1/1 (129)
12:42:12.371968 IP san.54464 > 10.0.6.11.domain: 56880+ [1au] AAAA? eapi.pcloud.com. (44)
12:42:12.372234 IP 10.0.6.11.domain > san.54464: 56880 0/1/1 (129)
12:42:12.389169 IP san.47709 > 10.0.6.11.domain: 46671+ [1au] AAAA? eapi.pcloud.com. (44)
12:42:12.389452 IP 10.0.6.11.domain > san.47709: 46671 0/1/1 (129)
12:42:12.399832 IP san.60255 > 10.0.6.11.domain: 59460+ [1au] AAAA? eapi.pcloud.com. (44)
12:42:12.400169 IP 10.0.6.11.domain > san.60255: 59460 0/1/1 (129)
12:42:12.412002 IP san.42800 > 10.0.6.11.domain: 32714+ [1au] AAAA? eapi.pcloud.com. (44)
12:42:12.412249 IP 10.0.6.11.domain > san.42800: 32714 0/1/1 (129)
12:42:12.422184 IP san.56874 > 10.0.6.11.domain: 15392+ [1au] AAAA? eapi.pcloud.com. (44)
12:42:12.422362 IP 10.0.6.11.domain > san.56874: 15392 0/1/1 (129)
12:42:12.434561 IP san.53589 > 10.0.6.11.domain: 35510+ [1au] AAAA? eapi.pcloud.com. (44)
12:42:12.434843 IP 10.0.6.11.domain > san.53589: 35510 0/1/1 (129)
12:42:12.444763 IP san.35024 > 10.0.6.11.domain: 39824+ [1au] AAAA? eapi.pcloud.com. (44)
12:42:12.445005 IP 10.0.6.11.domain > san.35024: 39824 0/1/1 (129)
12:42:12.456273 IP san.33331 > 10.0.6.11.domain: 24754+ [1au] AAAA? eapi.pcloud.com. (44)
12:42:12.456550 IP 10.0.6.11.domain > san.33331: 24754 0/1/1 (129)
12:42:12.466654 IP san.58535 > 10.0.6.11.domain: 64675+ [1au] AAAA? eapi.pcloud.com. (44)
12:42:12.466926 IP 10.0.6.11.domain > san.58535: 64675 0/1/1 (129)
12:42:12.479412 IP san.57519 > 10.0.6.11.domain: 25507+ [1au] AAAA? eapi.pcloud.com. (44)
12:42:12.479665 IP 10.0.6.11.domain > san.57519: 25507 0/1/1 (129)
12:42:12.506212 IP san.40827 > 10.0.6.11.domain: 35903+ [1au] AAAA? eapi.pcloud.com. (44)
12:42:12.506452 IP 10.0.6.11.domain > san.40827: 35903 0/1/1 (129)
12:42:12.516181 IP san.51789 > 10.0.6.11.domain: 62705+ [1au] AAAA? eapi.pcloud.com. (44)
12:42:12.516442 IP 10.0.6.11.domain > san.51789: 62705 0/1/1 (129)
12:42:12.527198 IP san.52193 > 10.0.6.11.domain: 52388+ [1au] AAAA? eapi.pcloud.com. (44)
12:42:12.527471 IP 10.0.6.11.domain > san.52193: 52388 0/1/1 (129)
12:42:12.538021 IP san.58286 > 10.0.6.11.domain: 37345+ [1au] AAAA? eapi.pcloud.com. (44)
12:42:12.538290 IP 10.0.6.11.domain > san.58286: 37345 0/1/1 (129)
12:42:12.548345 IP san.32999 > 10.0.6.11.domain: 31316+ [1au] AAAA? eapi.pcloud.com. (44)
12:42:12.548595 IP 10.0.6.11.domain > san.32999: 31316 0/1/1 (129)
12:42:12.558721 IP san.52654 > 10.0.6.11.domain: 27283+ [1au] AAAA? eapi.pcloud.com. (44)
12:42:12.559048 IP 10.0.6.11.domain > san.52654: 27283 0/1/1 (129)
12:42:12.569887 IP san.37075 > 10.0.6.11.domain: 34753+ [1au] AAAA? eapi.pcloud.com. (44)
12:42:12.570187 IP 10.0.6.11.domain > san.37075: 34753 0/1/1 (129)
12:42:12.581672 IP san.49033 > 10.0.6.11.domain: 59670+ [1au] AAAA? eapi.pcloud.com. (44)
12:42:12.581938 IP 10.0.6.11.domain > san.49033: 59670 0/1/1 (129)
12:42:12.592038 IP san.43815 > 10.0.6.11.domain: 14505+ [1au] AAAA? eapi.pcloud.com. (44)
12:42:12.592384 IP 10.0.6.11.domain > san.43815: 14505 0/1/1 (129)
12:42:12.602846 IP san.60829 > 10.0.6.11.domain: 9468+ [1au] AAAA? eapi.pcloud.com. (44)
12:42:12.603076 IP 10.0.6.11.domain > san.60829: 9468 0/1/1 (129)
12:42:12.613477 IP san.48158 > 10.0.6.11.domain: 40844+ [1au] AAAA? eapi.pcloud.com. (44)
12:42:12.613755 IP 10.0.6.11.domain > san.48158: 40844 0/1/1 (129)
12:42:12.623914 IP san.56729 > 10.0.6.11.domain: 50682+ [1au] AAAA? eapi.pcloud.com. (44)
12:42:12.624162 IP 10.0.6.11.domain > san.56729: 50682 0/1/1 (129)
12:42:12.635514 IP san.49517 > 10.0.6.11.domain: 1325+ [1au] AAAA? eapi.pcloud.com. (44)
12:42:12.635733 IP 10.0.6.11.domain > san.49517: 1325 0/1/1 (129)
12:42:12.652914 IP san.58687 > 10.0.6.11.domain: 6281+ [1au] AAAA? eapi.pcloud.com. (44)
12:42:12.653141 IP 10.0.6.11.domain > san.58687: 6281 0/1/1 (129)
12:42:12.666905 IP san.44296 > 10.0.6.11.domain: 56326+ [1au] AAAA? eapi.pcloud.com. (44)
12:42:12.667223 IP 10.0.6.11.domain > san.44296: 56326 0/1/1 (129)
12:42:12.677601 IP san.49325 > 10.0.6.11.domain: 64111+ [1au] AAAA? eapi.pcloud.com. (44)
12:42:12.677866 IP 10.0.6.11.domain > san.49325: 64111 0/1/1 (129)
12:42:12.688989 IP san.38334 > 10.0.6.11.domain: 28924+ [1au] AAAA? eapi.pcloud.com. (44)
12:42:12.689250 IP 10.0.6.11.domain > san.38334: 28924 0/1/1 (129)
12:42:12.701900 IP san.46602 > 10.0.6.11.domain: 62153+ [1au] AAAA? eapi.pcloud.com. (44)
12:42:12.702133 IP 10.0.6.11.domain > san.46602: 62153 0/1/1 (129)
12:42:12.713021 IP san.52516 > 10.0.6.11.domain: 31230+ [1au] AAAA? eapi.pcloud.com. (44)
12:42:12.713269 IP 10.0.6.11.domain > san.52516: 31230 0/1/1 (129)
12:42:12.724316 IP san.45305 > 10.0.6.11.domain: 39182+ [1au] AAAA? eapi.pcloud.com. (44)
12:42:12.724656 IP 10.0.6.11.domain > san.45305: 39182 0/1/1 (129)
12:42:12.734850 IP san.41087 > 10.0.6.11.domain: 46522+ [1au] AAAA? eapi.pcloud.com. (44)
12:42:12.735087 IP 10.0.6.11.domain > san.41087: 46522 0/1/1 (129)
12:42:12.747322 IP san.60549 > 10.0.6.11.domain: 60473+ [1au] AAAA? eapi.pcloud.com. (44)
12:42:12.747608 IP 10.0.6.11.domain > san.60549: 60473 0/1/1 (129)
12:42:12.757477 IP san.54139 > 10.0.6.11.domain: 65203+ [1au] AAAA? eapi.pcloud.com. (44)
12:42:12.757728 IP 10.0.6.11.domain > san.54139: 65203 0/1/1 (129)
12:42:12.769631 IP san.43781 > 10.0.6.11.domain: 58848+ [1au] AAAA? eapi.pcloud.com. (44)
12:42:12.769903 IP 10.0.6.11.domain > san.43781: 58848 0/1/1 (129)
12:42:12.781622 IP san.59789 > 10.0.6.11.domain: 8155+ [1au] AAAA? eapi.pcloud.com. (44)
12:42:12.781837 IP 10.0.6.11.domain > san.59789: 8155 0/1/1 (129)
12:42:12.792060 IP san.46760 > 10.0.6.11.domain: 25287+ [1au] AAAA? eapi.pcloud.com. (44)
12:42:12.792260 IP 10.0.6.11.domain > san.46760: 25287 0/1/1 (129)
12:42:12.802660 IP san.55299 > 10.0.6.11.domain: 30598+ [1au] AAAA? eapi.pcloud.com. (44)
12:42:12.802874 IP 10.0.6.11.domain > san.55299: 30598 0/1/1 (129)
12:42:12.814076 IP san.33075 > 10.0.6.11.domain: 54921+ [1au] AAAA? eapi.pcloud.com. (44)
12:42:12.814274 IP 10.0.6.11.domain > san.33075: 54921 0/1/1 (129)
12:42:12.824268 IP san.52796 > 10.0.6.11.domain: 31347+ [1au] AAAA? eapi.pcloud.com. (44)
12:42:12.824519 IP 10.0.6.11.domain > san.52796: 31347 0/1/1 (129)
12:42:12.838905 IP san.39866 > 10.0.6.11.domain: 41723+ [1au] AAAA? eapi.pcloud.com. (44)
12:42:12.839083 IP 10.0.6.11.domain > san.39866: 41723 0/1/1 (129)
12:42:12.865227 IP san.35528 > 10.0.6.11.domain: 3771+ [1au] AAAA? eapi.pcloud.com. (44)
12:42:12.865477 IP 10.0.6.11.domain > san.35528: 3771 0/1/1 (129)
12:42:12.875576 IP san.51479 > 10.0.6.11.domain: 7988+ [1au] AAAA? eapi.pcloud.com. (44)
12:42:12.875779 IP 10.0.6.11.domain > san.51479: 7988 0/1/1 (129)
12:42:12.886135 IP san.58596 > 10.0.6.11.domain: 31465+ [1au] AAAA? eapi.pcloud.com. (44)
12:42:12.886353 IP 10.0.6.11.domain > san.58596: 31465 0/1/1 (129)
12:42:12.896441 IP san.56696 > 10.0.6.11.domain: 14764+ [1au] AAAA? eapi.pcloud.com. (44)
12:42:12.896686 IP 10.0.6.11.domain > san.56696: 14764 0/1/1 (129)
12:42:12.907550 IP san.57137 > 10.0.6.11.domain: 14878+ [1au] AAAA? eapi.pcloud.com. (44)
12:42:12.907811 IP 10.0.6.11.domain > san.57137: 14878 0/1/1 (129)
12:42:12.919432 IP san.35364 > 10.0.6.11.domain: 39307+ [1au] AAAA? eapi.pcloud.com. (44)
12:42:12.919753 IP 10.0.6.11.domain > san.35364: 39307 0/1/1 (129)
12:42:12.930661 IP san.46945 > 10.0.6.11.domain: 61818+ [1au] AAAA? eapi.pcloud.com. (44)
12:42:12.931014 IP 10.0.6.11.domain > san.46945: 61818 0/1/1 (129)
12:42:12.940796 IP san.37249 > 10.0.6.11.domain: 18140+ [1au] AAAA? eapi.pcloud.com. (44)
12:42:12.941027 IP 10.0.6.11.domain > san.37249: 18140 0/1/1 (129)
12:42:12.951943 IP san.58435 > 10.0.6.11.domain: 16812+ [1au] AAAA? eapi.pcloud.com. (44)
12:42:12.952184 IP 10.0.6.11.domain > san.58435: 16812 0/1/1 (129)
12:42:12.962406 IP san.54598 > 10.0.6.11.domain: 6602+ [1au] AAAA? eapi.pcloud.com. (44)
12:42:12.962623 IP 10.0.6.11.domain > san.54598: 6602 0/1/1 (129)
12:42:12.975170 IP san.34831 > 10.0.6.11.domain: 30565+ [1au] AAAA? eapi.pcloud.com. (44)
12:42:12.975393 IP 10.0.6.11.domain > san.34831: 30565 0/1/1 (129)
12:42:12.985638 IP san.46517 > 10.0.6.11.domain: 63283+ [1au] AAAA? eapi.pcloud.com. (44)
12:42:12.985857 IP 10.0.6.11.domain > san.46517: 63283 0/1/1 (129)
12:42:12.996275 IP san.41312 > 10.0.6.11.domain: 33813+ [1au] AAAA? eapi.pcloud.com. (44)
12:42:12.996565 IP 10.0.6.11.domain > san.41312: 33813 0/1/1 (129)

**Comment by ncw** [comment]
How did you disable IPv6? With `net.ipv6.conf.all.disable_ipv6 = 1` or otherwise?

This behaviour is likely from the go standard library rather than rclone.
