### ISSUE TITLE
Serve DLNA not wokrking on Oculus Go and LG TV (2012 model)

### ISSUE THREAD

**Issue by tabnk** [rclone/rclone#3050]
#### What is the problem you are having with rclone?

DLNA not working  on Oculus Go and LG TV (2012 model). 

On oculus go, it shown rclone (DLNA) but no media was found.

On LG TV, it shown rclone (DLNA) but TV auto restart when selected.

#### What is your rclone version (output from `rclone version`)

Ver 1.46.

#### Which OS you are using and how many bits (eg Windows 7, 64 bit)

Windows 10, 64-bit

####  Which cloud storage system are you using? (eg Google Drive)

Google Drive/Team Drive

#### The command you were trying to run (eg `rclone copy /tmp remote:tmp`)

rclone serve dlna remote:Backup\Media

#### A log from the command with the `-vv` flag (eg output from `rclone -vv copy /tmp remote:tmp`)

019/03/15 02:37:43 DEBUG : Adding path "vfs/forget" to remote control registry
2019/03/15 02:37:43 DEBUG : Adding path "vfs/refresh" to remote control registry
2019/03/15 02:37:43 DEBUG : Adding path "vfs/poll-interval" to remote control registry
2019/03/15 02:37:43 NOTICE: Google drive root 'Backup/Media': Serving HTTP on [::]:7879
2019/03/15 02:37:43 Started SSDP on Ethernet

**Comment by ncw** [comment]
The situation has been improved by #3045 but it isn't 100% - is that right @tabnk and @sretlawd ?

**Comment by tabnk** [comment]
@ncw Yes, Oculus Go work and no crash.  Only issue left is my LG TV (PRE-WEBOS) which doesn’t work and cause my TV to restart itself.

**Comment by sretlawd** [comment]
I did do a small implementation of the ConnectionManager interface, just doing what Emby does, the other day @sretlawd/rclone@07dfb81faf95b10c2cb707f55a6ed56bdedeadbb.  I don't expect it to make much of a difference, but there's always the possibility.  There's a lot of finicky clients out there.

@tabnk can you get a packet trace of the requests from your TV?  I got my devices working by running wireshark, capture tcp 7879 and udp 1900, and seeing what it's trying to do.

**Comment by tabnk** [comment]
@sretlawd I’m will try wireshark now.

**Comment by tabnk** [comment]
@sretlawd  

Frame 41: 60 bytes on wire (480 bits), 60 bytes captured (480 bits) on interface 0
    Interface id: 0 (\Device\NPF_{8E02BB33-2A7A-4082-980A-56DFBA01910F})
    [Time shift for this packet: 0.000000000 seconds]
    Epoch Time: 1552660008.263720000 seconds
    [Time delta from previous captured frame: 0.000338000 seconds]
    [Time delta from previous displayed frame: 0.000338000 seconds]
    [Time since reference or first frame: 74.377881000 seconds]
    Frame Number: 41
    Frame Length: 60 bytes (480 bits)
    Capture Length: 60 bytes (480 bits)
    [Frame is marked: False]
    [Frame is ignored: False]
    [Protocols in frame: eth:ethertype:ip:tcp]
    [Coloring Rule Name: TCP]
    [Coloring Rule String: tcp]
Ethernet II, Src: LgElectr_14:44:2c (c0:41:f6:14:44:2c), Dst: HonHaiPr_e3:5c:d8 (d0:27:88:e3:5c:d8)
Internet Protocol Version 4, Src: 192.168.1.143, Dst: 192.168.1.250
Transmission Control Protocol, Src Port: 45022, Dst Port: 7879, Seq: 2, Ack: 2, Len: 0

**Comment by tabnk** [comment]
Not sure where to configure UDP 1900.

**Comment by tabnk** [comment]
53	108.751193	192.168.1.143	192.168.1.250	HTTP	270	GET /rootDesc.xml HTTP/1.1

**Comment by tabnk** [comment]
Frame 56: 320 bytes on wire (2560 bits), 320 bytes captured (2560 bits) on interface 0
    Interface id: 0 (\Device\NPF_{8E02BB33-2A7A-4082-980A-56DFBA01910F})
    [Time shift for this packet: 0.000000000 seconds]
    Epoch Time: 1552661312.154053000 seconds
    [Time delta from previous captured frame: 0.023343000 seconds]
    [Time delta from previous displayed frame: 0.023343000 seconds]
    [Time since reference or first frame: 20.071386000 seconds]
    Frame Number: 56
    Frame Length: 320 bytes (2560 bits)
    Capture Length: 320 bytes (2560 bits)
    [Frame is marked: False]
    [Frame is ignored: False]
    [Protocols in frame: eth:ethertype:ip:udp:ssdp]
    [Coloring Rule Name: UDP]
    [Coloring Rule String: udp]
Ethernet II, Src: HonHaiPr_e3:5c:d8 (d0:27:88:e3:5c:d8), Dst: IPv4mcast_7f:ff:fa (01:00:5e:7f:ff:fa)
Internet Protocol Version 4, Src: 192.168.1.250, Dst: 239.255.255.250
User Datagram Protocol, Src Port: 1900, Dst Port: 1900
Simple Service Discovery Protocol
    NOTIFY * HTTP/1.1\r\n
    HOST: 239.255.255.250:1900\r\n
    NT: upnp:rootdevice\r\n
    NTS: ssdp:alive\r\n
    SERVER: Linux/3.4 DLNADOC/1.50 UPnP/1.0 DMS/1.0\r\n
    USN: uuid:8e3805e1-a30d-5ad2-02cb-209344da35ff::upnp:rootdevice\r\n
    CACHE-CONTROL: max-age=25\r\n
    LOCATION: http://192.168.1.250:7879/rootDesc.xml\r\n
    \r\n
    [Full request URI: http://239.255.255.250:1900*]

**Comment by tabnk** [comment]
Ok, attached wireshark packet file. 
[LGTV2.zip](https://github.com/ncw/rclone/files/2971622/LGTV2.zip)

**Comment by sretlawd** [comment]
That has the UDP stuff (which looks OK), can get you get the TCP too?  The filter in capture options should be something like "tcp port 7879 or udp port 1900”.

**Comment by tabnk** [comment]
Ok, attached new wireshark packet file.
[LGTV3.zip](https://github.com/ncw/rclone/files/2972076/LGTV3.zip)

**Comment by sretlawd** [comment]
That’s exactly what was happening on my LG webOS 2.2.1 before I added the ConnectionManager interface in caf318d - you've definitely rebuilt with that change?

**Comment by tabnk** [comment]
I’m using this build. 
https://ci.appveyor.com/api/buildjobs/14w61trqi1m8re32/artifacts/build%2Frclone-v1.46.0-073-gcaf318d4-beta-windows-amd64.zip

**Comment by sretlawd** [comment]
That’s the one then - well, it looks like the same sort of issue, and has to be something in the rootDesc.xml, because it’s not getting far beyond that.

My best guess would be that it’s necessary to advertise the X_MS_MediaReceiverRegistrar interface as well (every other implementation I’ve looked at seems to have it, and from commit logs I gather it’s necessary for some Microsoft devices, like the X-Box..)  There’s also a few other bits and pieces that other implementations have in the rootDesc.xml that aren’t required by spec, but some devices might assume to be there.

**Comment by tabnk** [comment]
I see. :(

**Comment by tabnk** [comment]
Is this code 
https://github.com/ncw/rclone/blob/master/cmd/serve/dlna/dlna.go

if I’m want to modify it?

**Comment by sretlawd** [comment]
Yeah, the best way I can explain it is to change the line:

        s.rootDescXML = append([]byte(`<?xml version="1.0"?>`), s.rootDescXML...)

To a literal that lets you put in whatever you want; pulling the XML from your pcap, it’d be like this:

    s.rootDescXML = []byte(`
<?xml version="1.0"?> <root xmlns="urn:schemas-upnp-org:device-1-0">
<specVersion>
<major>1</major>
<minor>0</minor>
</specVersion>
<device>
<deviceType>urn:schemas-upnp-org:device:MediaServer:1</deviceType>
<friendlyName>rclone (nanoPC)</friendlyName>
<manufacturer>rclone (rclone.org)</manufacturer>
<modelName>rclone</modelName>
<UDN>uuid:8e3805e1-a30d-5ad2-02cb-209344da35ff</UDN>
<iconList></iconList>
<serviceList>
<service>
<serviceType>urn:schemas-upnp-org:service:ContentDirectory:1</serviceType>
<serviceId>urn:upnp-org:serviceId:ContentDirectory</serviceId>
<SCPDURL>/scpd/urn:upnp-org:serviceId:ContentDirectory</SCPDURL>
<controlURL>/ctl</controlURL>
<eventSubURL></eventSubURL>
</service>
<service>
<serviceType>urn:schemas-upnp-org:service:ConnectionManager:1</serviceType>
<serviceId>urn:upnp-org:serviceId:ConnectionManager</serviceId>
<SCPDURL>/scpd/urn:upnp-org:serviceId:ConnectionManager</SCPDURL>
<controlURL>/ctl</controlURL>
<eventSubURL></eventSubURL>
</service>
</serviceList>
</device>
</root>
`)

Then you just modify the XML and build/restart/try again until you see some progress, comparing with an implementation that works.

**Comment by tabnk** [comment]
Just check 
https://github.com/ncw/rclone but no instruction to setup on Windows for building/compiling. 

Not much I’m can do now.

**Comment by ncw** [comment]
> Just check
> https://github.com/ncw/rclone but no instruction to setup on Windows for building/compiling.
> 
> Not much I’m can do now.

Here are the instructions for building from source - these should work fine on Windows

https://rclone.org/install/#install-from-source

**Comment by tabnk** [comment]
> > Just check
> > https://github.com/ncw/rclone but no instruction to setup on Windows for building/compiling.
> > Not much I’m can do now.
> 
> Here are the instructions for building from source - these should work fine on Windows
> 
> https://rclone.org/install/#install-from-source

Nice, will it give a try.

**Comment by tabnk** [comment]
X_MS_MediaReceiverRegistrar is for Xbox/MS stuff. I think adding this will not resolve LG TV issue.

**Comment by tabnk** [comment]
I'm manage to build rclone on Windows. I even replace all Description code with https://github.com/nmaier/simpleDLNA/tree/master/server/Resources but LG TV still cannot view any media file. 

X_MS_MediaReceiverRegistrar was added too. Nothing change.

**Comment by tabnk** [comment]
After investigation, problem likely is rootDesc.xml. 

Below seem to be missing something. 
<controlURL>/ctl</controlURL>
<eventSubURL></eventSubURL>

**Comment by tabnk** [comment]
Don't know what to do now. :D

**Comment by sretlawd** [comment]
I’m adding various bits of XML trying to get fast forward / pause / rewind working - some of the same additions might help, so would give that a try when I submit it..

**Comment by tabnk** [comment]
Nice, will definitely try it.

**Comment by tabnk** [comment]
Any update?

**Comment by sretlawd** [comment]
Haven’t had a chance to play with it lately, hopefully this week.  :-)

**Comment by tabnk** [comment]
Tks. :)

**Comment by sretlawd** [comment]
I basically implemented a whole bunch of stuff over at sretlawd/rclone@d03009b37cd6289a6d252694aa2ed7d8177c3835 - fast forwarding is working now on my LG.  If you figured out how to do a build, you may want to give it a try.

**Comment by tabnk** [comment]
Going to try it now.

**Comment by tabnk** [comment]
Tried but it still doesn't work on my LG TV. Perhaps, Pre-WebOS TV was just too old to support rclone DLNA. Nevermind. :)

**Comment by sretlawd** [comment]
Yeah it’s an easy one, my local tree is pretty different from master but I’ll try to give it a go over the weekend..

**Comment by sretlawd** [comment]
Ah, sorry, got my issues mixed up!  Everything in that commit should already be in master.

**Comment by ivandeex** [comment]
@sretlawd Could you please re-submit https://github.com/sretlawd/rclone/commit/d03009b37cd6289a6d252694aa2ed7d8177c3835 as a PR?

**Comment by ivandeex** [comment]
Closing after 1 year and 4 months of inactivity
